{
  "files": [
    {
      "expected_match": true,
      "expected_sha256": "ce28fbf5f6f4cd63519c871c5726507bf88b3661422531c592e94c2b9c9a62bc",
      "path": "include/demo.h",
      "sha256": "ce28fbf5f6f4cd63519c871c5726507bf88b3661422531c592e94c2b9c9a62bc",
      "size_bytes": 57
    },
    {
      "expected_match": true,
      "expected_sha256": "570ff1e1af43417287ff3d71cf5c2dbb9f605cba64f3cc02453a6f417dca81d8",
      "path": "src/demo.c",
      "sha256": "570ff1e1af43417287ff3d71cf5c2dbb9f605cba64f3cc02453a6f417dca81d8",
      "size_bytes": 55
    },
    {
      "expected_match": true,
      "expected_sha256": "55b7c8ee67daefa5a2a93abb6d5106f30c83e13fbc1d1debcefbb8ca03a68c0e",
      "path": "src/harness.c",
      "sha256": "55b7c8ee67daefa5a2a93abb6d5106f30c83e13fbc1d1debcefbb8ca03a68c0e",
      "size_bytes": 109
    }
  ],
  "phase": "BEFORE",
  "schema_version": "1.0",
  "workspace_root_sha256_disclosure": "PATH_NOT_HASHED"
}
